{
  "id": "STK-1",
  "criteria_sha256": "1efa487b0b8536068535e61ecc9b88fa562bff8c9b70c882034cc3838b49f03f",
  "criteria": {
    "C1": {
      "status": "PASS",
      "evidence": "check",
      "run": {
        "command": "yarn lint:docs",
        "exit": 0,
        "at": "2026-10-03T23:23:33Z",
        "head": "0dcce4cc20c284a4c012f2eb17269d19d5f7a246",
        "evidence_path": "specs/_shared/epics/STK-default-stack/tickets/STK-1-rulings-on-record/evidence/C1.log",
        "evidence_sha256": "0bf40348c6d9ec3206c0328ca32896083cfc784cae2e10a8562746310599022a"
      }
    },
    "C2": {
      "status": "PASS",
      "evidence": "check",
      "run": {
        "command": "yarn check-refs",
        "exit": 0,
        "at": "2026-10-03T23:23:34Z",
        "head": "0dcce4cc20c284a4c012f2eb17269d19d5f7a246",
        "evidence_path": "specs/_shared/epics/STK-default-stack/tickets/STK-1-rulings-on-record/evidence/C2.log",
        "evidence_sha256": "15e0688c8634a54ff3dbe2b38a54537017518ebdab427911aa71d8d6baed0c42"
      }
    },
    "C3": {
      "status": "PASS",
      "evidence": "check",
      "run": {
        "command": "yarn directory-map --check",
        "exit": 0,
        "at": "2026-10-03T23:23:34Z",
        "head": "0dcce4cc20c284a4c012f2eb17269d19d5f7a246",
        "evidence_path": "specs/_shared/epics/STK-default-stack/tickets/STK-1-rulings-on-record/evidence/C3.log",
        "evidence_sha256": "af9e92845de423e104b967a6acff922b8017734553cb335e9ce2e14a68e7f9d4"
      }
    },
    "C4": {
      "status": "PASS",
      "evidence": "manual",
      "run": {
        "command": "yarn contract:record STK-1 C4 --evidence specs/_shared/epics/STK-default-stack/tickets/STK-1-rulings-on-record/evidence/C4.md",
        "exit": 0,
        "at": "2026-10-03T23:24:24Z",
        "head": "0dcce4cc20c284a4c012f2eb17269d19d5f7a246",
        "evidence_path": "specs/_shared/epics/STK-default-stack/tickets/STK-1-rulings-on-record/evidence/C4.md",
        "evidence_sha256": "1a821bc9a31b9249f9ee98258232a5e2457ae25fbd8738123818aade03edaa17"
      }
    },
    "review:vigil": {
      "status": "PASS",
      "evidence": "manual",
      "run": {
        "command": "yarn review:run vigil STK-1",
        "exit": 0,
        "at": "2026-10-03T23:34:34Z",
        "head": "0aa89aa80e98f732873370054eb88aabd2e440bb",
        "evidence_path": "specs/_shared/epics/STK-default-stack/tickets/STK-1-rulings-on-record/review-vigil.md",
        "evidence_sha256": "9f343f901e2f9f8565287259923903ca409f4cbf195b6e81460469e7f6b52995",
        "contract_sha256": "f54b96df289bcb30de4e6f080127a29b09100cb2c79708926cc8865c6c48e006",
        "as_built_sha256": "60ec470a94bffd87f7810cca809356501c36812d7294832caee39950df7b4f6e",
        "runner": "claude 2.1.232 (Claude Code) (agent vigil; tools Read,Grep,Glob)"
      }
    }
  },
  "updated_at": "2026-10-03T23:39:47Z"
}
