{
  "id": "WEB-2",
  "criteria_sha256": "5c5fd99c7bb42969e94a9004cd3fb7ca45d751047cf904282b412b23d7479bb5",
  "criteria": {
    "C1": {
      "status": "PASS",
      "evidence": "test",
      "run": {
        "command": "yarn test:boundaries",
        "exit": 0,
        "at": "2026-10-04T07:36:12Z",
        "head": "f9d7da16f267b9c9391840a34863225c718fe896",
        "evidence_path": "specs/web/one-offs/WEB-2-boundaries-subpath-resolve/evidence/C1.log",
        "evidence_sha256": "a7f34a502b8cd2f2cff8949a8311de7c3618a6a7711ef5fea653f7f1f68d5c6e",
        "tests": 7
      }
    },
    "C2": {
      "status": "PASS",
      "evidence": "test",
      "run": {
        "command": "yarn test:boundaries",
        "exit": 0,
        "at": "2026-10-04T07:36:14Z",
        "head": "f9d7da16f267b9c9391840a34863225c718fe896",
        "evidence_path": "specs/web/one-offs/WEB-2-boundaries-subpath-resolve/evidence/C2.log",
        "evidence_sha256": "e794c6b6d54db2bedda53274c45c1368806009b22bae3d956645af444bb6f532",
        "tests": 7
      }
    },
    "C3": {
      "status": "PASS",
      "evidence": "check",
      "run": {
        "command": "yarn lint:boundaries",
        "exit": 0,
        "at": "2026-10-04T07:36:15Z",
        "head": "f9d7da16f267b9c9391840a34863225c718fe896",
        "evidence_path": "specs/web/one-offs/WEB-2-boundaries-subpath-resolve/evidence/C3.log",
        "evidence_sha256": "1b6aea9710b4c223e0915920e60d641fbca79da9380a8fe68dc09edd8937ba7f"
      }
    },
    "review:mason": {
      "status": "PASS",
      "evidence": "manual",
      "run": {
        "command": "yarn review:run mason WEB-2",
        "exit": 0,
        "at": "2026-10-04T07:37:21Z",
        "head": "9a473b11e473fe78f33f00fdf2c8a3ce745c677f",
        "evidence_path": "specs/web/one-offs/WEB-2-boundaries-subpath-resolve/review-mason.md",
        "evidence_sha256": "69a3a8855bc8854fb0b1f98edc0d68e4c4033b0dc82b48fd2ac485c7fad6dd3d",
        "contract_sha256": "5f3ce29eeb8f5ac5b6b4b3f38fd13c09156803be628708743452424d079b35f2",
        "as_built_sha256": "67149d91bbd0c72beaf33587a12ff26ca723f2ef8bee46998905c0624d0390ba",
        "runner": "claude 2.1.232 (Claude Code) (role docs/roles/engineering/mason-cto-principal-dev.md; tools Read,Grep,Glob)"
      }
    },
    "review:vigil": {
      "status": "FAIL",
      "evidence": "manual",
      "run": null
    },
    "review:warden": {
      "status": "FAIL",
      "evidence": "manual",
      "run": null
    }
  },
  "updated_at": "2026-10-04T07:43:44Z"
}
