{
  "id": "STK-2",
  "criteria_sha256": "cddfc4e1f41bd1e5705c79955d003d4624cee74aab8f2b04ba1837395742fc52",
  "criteria": {
    "C1": {
      "status": "PASS",
      "evidence": "test",
      "run": {
        "command": "yarn test:tooling",
        "exit": 0,
        "at": "2026-10-04T20:37:21Z",
        "head": "137bcff45dd0c8a422aebc5ffa605d27fd053656",
        "evidence_path": "specs/_shared/epics/STK-default-stack/tickets/STK-2-stack-manifest/evidence/C1.log",
        "evidence_sha256": "95441c248e6e46089b438533782f7388edab85369f419dc69b9b84daf24c4650",
        "tests": 51
      }
    },
    "C2": {
      "status": "PASS",
      "evidence": "test",
      "run": {
        "command": "yarn test:tooling",
        "exit": 0,
        "at": "2026-10-04T20:37:46Z",
        "head": "137bcff45dd0c8a422aebc5ffa605d27fd053656",
        "evidence_path": "specs/_shared/epics/STK-default-stack/tickets/STK-2-stack-manifest/evidence/C2.log",
        "evidence_sha256": "4479f940f37f2a1d9b1726ae808981f4729f9cb43c789c5aad56ef3378f07426",
        "tests": 51
      }
    },
    "C3": {
      "status": "PASS",
      "evidence": "test",
      "run": {
        "command": "yarn test:tooling",
        "exit": 0,
        "at": "2026-10-04T20:38:12Z",
        "head": "137bcff45dd0c8a422aebc5ffa605d27fd053656",
        "evidence_path": "specs/_shared/epics/STK-default-stack/tickets/STK-2-stack-manifest/evidence/C3.log",
        "evidence_sha256": "428c67a383afc3025c4beb6511cad7b183e25c4fdecdf4b89b0880d2bf5a83d6",
        "tests": 51
      }
    },
    "C4": {
      "status": "PASS",
      "evidence": "test",
      "run": {
        "command": "yarn test:tooling",
        "exit": 0,
        "at": "2026-10-04T20:38:40Z",
        "head": "137bcff45dd0c8a422aebc5ffa605d27fd053656",
        "evidence_path": "specs/_shared/epics/STK-default-stack/tickets/STK-2-stack-manifest/evidence/C4.log",
        "evidence_sha256": "2b2954964037e59419566fea2425c770b358c8ae77db4b4fb9269c0cca90d910",
        "tests": 51
      }
    },
    "C5": {
      "status": "PASS",
      "evidence": "test",
      "run": {
        "command": "yarn test:tooling",
        "exit": 0,
        "at": "2026-10-04T20:39:06Z",
        "head": "137bcff45dd0c8a422aebc5ffa605d27fd053656",
        "evidence_path": "specs/_shared/epics/STK-default-stack/tickets/STK-2-stack-manifest/evidence/C5.log",
        "evidence_sha256": "93eb369a5dafdde7b9b5e7b90a6ef1230a2fa2243a9cbb1f974ab63ce9da9d56",
        "tests": 51
      }
    },
    "C6": {
      "status": "PASS",
      "evidence": "check",
      "run": {
        "command": "yarn check-types:tooling",
        "exit": 0,
        "at": "2026-10-04T20:39:32Z",
        "head": "137bcff45dd0c8a422aebc5ffa605d27fd053656",
        "evidence_path": "specs/_shared/epics/STK-default-stack/tickets/STK-2-stack-manifest/evidence/C6.log",
        "evidence_sha256": "fde53fe0c89bd6e16fb79faf450673a624aaeec78e7c7e21a8b02df275fb2322"
      }
    },
    "C7": {
      "status": "PASS",
      "evidence": "check",
      "run": {
        "command": "yarn verify",
        "exit": 0,
        "at": "2026-10-04T20:39:51Z",
        "head": "137bcff45dd0c8a422aebc5ffa605d27fd053656",
        "evidence_path": "specs/_shared/epics/STK-default-stack/tickets/STK-2-stack-manifest/evidence/C7.log",
        "evidence_sha256": "ef8e3b2d96c27c2bad308e8e7d0c388cd0fd21c06a912d0c4e9f14cb9d82a36f"
      }
    }
  },
  "updated_at": "2026-10-04T20:41:07Z"
}
