{
  "id": "STK-10",
  "criteria_sha256": "9d7098e5aa38417abdd5a726e38142f9c50c912ae6c1c4cfda1d8fc48f7fafdd",
  "criteria": {
    "C1": {
      "status": "FAIL",
      "evidence": "test",
      "run": null
    },
    "C2": {
      "status": "FAIL",
      "evidence": "check",
      "run": null
    },
    "C3": {
      "status": "FAIL",
      "evidence": "check",
      "run": null
    },
    "C4": {
      "status": "FAIL",
      "evidence": "test",
      "run": null
    },
    "review:mason": {
      "status": "FAIL",
      "evidence": "manual",
      "run": null
    },
    "review:vigil": {
      "status": "FAIL",
      "evidence": "manual",
      "run": null
    },
    "review:warden": {
      "status": "FAIL",
      "evidence": "manual",
      "run": null
    }
  },
  "updated_at": "2026-10-04T06:47:46Z"
}
