{
  "id": "STK-4",
  "criteria_sha256": "716da9c48d921a609766f6ee544fdc61b342f7e05abde96b1841600ad0277d6b",
  "criteria": {
    "C1": {
      "status": "PASS",
      "evidence": "test",
      "run": {
        "command": "yarn test",
        "exit": 0,
        "at": "2026-10-04T06:44:32Z",
        "head": "33fbc0813327394fd171e8d362065672e4e3b5e9",
        "evidence_path": "specs/_shared/epics/STK-default-stack/tickets/STK-4-env-module/evidence/C1.log",
        "evidence_sha256": "94b9083ca793856b479a86588c0d21bbd8a9aab706f0419850f7b2f5c87ff55f",
        "tests": 27
      }
    },
    "C2": {
      "status": "PASS",
      "evidence": "test",
      "run": {
        "command": "yarn test",
        "exit": 0,
        "at": "2026-10-04T06:44:33Z",
        "head": "33fbc0813327394fd171e8d362065672e4e3b5e9",
        "evidence_path": "specs/_shared/epics/STK-default-stack/tickets/STK-4-env-module/evidence/C2.log",
        "evidence_sha256": "a70656acdd726f516aa89e349344002e946469c29b02c2a62f6e5230ae1a90b8",
        "tests": 27
      }
    },
    "C3": {
      "status": "PASS",
      "evidence": "check",
      "run": {
        "command": "yarn lint:boundaries",
        "exit": 0,
        "at": "2026-10-04T06:44:33Z",
        "head": "33fbc0813327394fd171e8d362065672e4e3b5e9",
        "evidence_path": "specs/_shared/epics/STK-default-stack/tickets/STK-4-env-module/evidence/C3.log",
        "evidence_sha256": "6399822690c1de03209fa754946f86b436878139430b2b769083b36fa27f7d53"
      }
    },
    "C4": {
      "status": "PASS",
      "evidence": "check",
      "run": {
        "command": "yarn check-types",
        "exit": 0,
        "at": "2026-10-04T06:44:35Z",
        "head": "33fbc0813327394fd171e8d362065672e4e3b5e9",
        "evidence_path": "specs/_shared/epics/STK-default-stack/tickets/STK-4-env-module/evidence/C4.log",
        "evidence_sha256": "303ab27a7d3465798cc635d44f8eb247bc2e701050ee2630f4e666a5fa91c508"
      }
    },
    "C5": {
      "status": "PASS",
      "evidence": "test",
      "run": {
        "command": "yarn test:tooling",
        "exit": 0,
        "at": "2026-10-04T06:44:35Z",
        "head": "33fbc0813327394fd171e8d362065672e4e3b5e9",
        "evidence_path": "specs/_shared/epics/STK-default-stack/tickets/STK-4-env-module/evidence/C5.log",
        "evidence_sha256": "b045b2d8d95d35fb7c5ea96502c430829bd1622ba6f2e8f29a574d03a8656f75",
        "tests": 39
      }
    },
    "C6": {
      "status": "PASS",
      "evidence": "check",
      "run": {
        "command": "yarn verify",
        "exit": 0,
        "at": "2026-10-04T06:39:41Z",
        "head": "52541804cfcf059cd2b03f1e94e36ca7e7177ecf",
        "evidence_path": "specs/_shared/epics/STK-default-stack/tickets/STK-4-env-module/evidence/C6.log",
        "evidence_sha256": "6879d3d43dec36d28ccca20347301a98ebee3fb3b1892c228d9e6009713ed6db"
      }
    },
    "review:mason": {
      "status": "PASS",
      "evidence": "manual",
      "run": {
        "command": "yarn review:run mason STK-4",
        "exit": 0,
        "at": "2026-10-04T05:04:22Z",
        "head": "4561b04bcb7302b92dfc376dbbec4421ff576eb9",
        "evidence_path": "specs/_shared/epics/STK-default-stack/tickets/STK-4-env-module/review-mason.md",
        "evidence_sha256": "c888e5609923a9049fe09ec320ef629eea0d85aa722553b62926cd3941efeeea",
        "contract_sha256": "db07be97c45119b2c225fa5d746d1be093caf2258b16bc12bda576e1db822d2b",
        "as_built_sha256": "35661d08540697a80b9ab41bd6b2ecfcd9b5efad141be7248cba3ba76cd9834a",
        "runner": "claude 2.1.232 (Claude Code) (role docs/roles/engineering/mason-cto-principal-dev.md; tools Read,Grep,Glob)"
      }
    },
    "review:vigil": {
      "status": "PASS",
      "evidence": "manual",
      "run": {
        "command": "yarn review:run vigil STK-4",
        "exit": 0,
        "at": "2026-10-04T05:09:54Z",
        "head": "4561b04bcb7302b92dfc376dbbec4421ff576eb9",
        "evidence_path": "specs/_shared/epics/STK-default-stack/tickets/STK-4-env-module/review-vigil.md",
        "evidence_sha256": "46d877200fe35b169755135abc5a19a79634925a1d802452d3cd58db5d700d90",
        "contract_sha256": "db07be97c45119b2c225fa5d746d1be093caf2258b16bc12bda576e1db822d2b",
        "as_built_sha256": "35661d08540697a80b9ab41bd6b2ecfcd9b5efad141be7248cba3ba76cd9834a",
        "runner": "claude 2.1.232 (Claude Code) (agent vigil; tools Read,Grep,Glob)"
      }
    },
    "review:warden": {
      "status": "PASS",
      "evidence": "manual",
      "run": {
        "command": "yarn review:run warden STK-4",
        "exit": 0,
        "at": "2026-10-04T05:14:46Z",
        "head": "4561b04bcb7302b92dfc376dbbec4421ff576eb9",
        "evidence_path": "specs/_shared/epics/STK-default-stack/tickets/STK-4-env-module/review-warden.md",
        "evidence_sha256": "203a1615f51c855eee524a1ec9a35add18636af63193b6adaf0455656e67520b",
        "contract_sha256": "db07be97c45119b2c225fa5d746d1be093caf2258b16bc12bda576e1db822d2b",
        "as_built_sha256": "35661d08540697a80b9ab41bd6b2ecfcd9b5efad141be7248cba3ba76cd9834a",
        "runner": "claude 2.1.232 (Claude Code) (role docs/roles/engineering/warden-security-privacy-engineer.md; tools Read,Grep,Glob)"
      }
    }
  },
  "updated_at": "2026-10-04T06:45:02Z"
}
